{
  "schema_identity": "infinium.repository.m1-slice6-development-campaign-amendment/8.0.0",
  "amendment_id": "infinium.m1-s6.credential-replacement-generation-3/20260822-exact-credential-bytes",
  "status": "owner-authorized-credential-replacement-generation-3",
  "owner_authority_source": {
    "kind": "current-owner-task-message",
    "summary": "use the confirmed-working fresh key through the masked credential enrollment surface"
  },
  "retained_wp9_failure": {
    "evidence": {
      "id": "successor-attempt-evidence-m1-s6-successor-v6-wp9-attempt-9/3637b14e-0d22-4a0c-88b2-c86bc57d871b",
      "path": "artifacts/m1-slice6/successor-campaign/wp9-attempt-9-9e47065a5bd548edaf9ea6ef6ec2aa92/attempt-evidence.v3.json",
      "sha256": "b8f66af50409db241ab85920dc2686380c9ede4314f4c2161cc644f0441a8a46"
    },
    "accepted_review": {
      "id": "infinium.m1-s6.successor-attempt-9-evidence-review-v3/8a34c582-888d-4be5-ba51-765222e084f1",
      "path": "artifacts/m1-slice6/successor-campaign/wp9-attempt-9-9e47065a5bd548edaf9ea6ef6ec2aa92/attempt-evidence-review.v3.json",
      "sha256": "abbf319aeeae271a02e45ff0c1afa95a4ccb48beb45df42fac6e2a7f0ebae081"
    },
    "observed_submitted_character_length": 91,
    "owner_confirmed_expected_character_length": 164
  },
  "retained_replacement_evidence": {
    "id": "infinium.m1-s6.successor-credential-replacement-evidence/0dd95374-f9e1-400a-888d-ffd56f680214",
    "path": "artifacts/m1-slice6/successor-credential-replacement-foreground-recovery/68898542-71bb-464e-a381-7e3829d65a37/replacement-evidence.v2.json",
    "sha256": "4778cb8e9275c34a5eab70d32635261f5ebf9eda75247960e7389e01fe448feb"
  },
  "retained_replacement_review": {
    "id": "infinium.m1-s6.successor-credential-replacement-evidence-review-v3/18cabac3-02ce-4f54-b19d-778ee7f94367",
    "path": "docs/plans/milestones/m1/slices/s6/m1-slice6-successor-credential-replacement-foreground-recovery-evidence-review.v3.json",
    "sha256": "85d09936320fd393abacb337031b6519843e580fcb93fb10d93eb82aee9db160"
  },
  "correction": {
    "defect_id": "successor-v6-credential-entry-and-bearer-byte-preservation",
    "implementation_commit": "41c0f1918910a4f230cccf045331f87e57cf6d03",
    "exact_character_length": 164,
    "exact_utf8_byte_length": 164,
    "canonical_alphabet": "ASCII letters digits hyphen underscore with sk- prefix",
    "bearer_byte_preservation": "exact-successor-only-header-admission-required"
  },
  "ledger_predecessor": {
    "path": "artifacts/m1-slice6/successor-campaign/ledger.v4.jsonl",
    "sha256": "232d0bc9d7f9a61f1cd87c9346cb2268aee6ea28e4be96a0e072df04ecbb4e27",
    "sequence": 44,
    "event_hash": "5dc8b3f2797620b305e3616d950c62e7b2f59d5b7c1ff6ce0a84f87b09e55e16",
    "committed_nano_usd": 1020640000,
    "outstanding_nano_usd": 0
  },
  "replacement": {
    "predecessor_generation_ordinal": 2,
    "successor_generation_ordinal": 3,
    "helper_launches": 1,
    "assignment_kind": "Replace",
    "automatic_retry": false,
    "enumeration": "prohibited",
    "overwrite": "prohibited-new-target-only",
    "dns_resolutions": 0,
    "network_operations": 0,
    "provider_operations": 0,
    "billable_operations": 0
  },
  "preserved_boundaries": {
    "hard_budget_nano_usd": 10000000000,
    "historical_evidence_immutable": true,
    "secret_isolation": true,
    "private_answer_isolation": true,
    "exposure": "prohibited",
    "slice7": "not-authorized"
  },
  "authorized_at_utc": "2026-08-22T02:20:23.5318523Z"
}
